{"$id":"https://outerheavenx.github.io/citadel-of-vesper/schemas/weapon.schema.json","$schema":"https://json-schema.org/draft/2020-12/schema","additionalProperties":false,"description":"Weapon definition. All weapons are original designs.","properties":{"attackProfile":{"additionalProperties":false,"description":"How this weapon changes combat feel (spec §15).","properties":{"activeFrames":{"type":"integer"},"animationKey":{"type":"string"},"anticipation":{"type":"number"},"attackSpeed":{"type":"number"},"hitbox":{"additionalProperties":false,"properties":{"h":{"type":"number"},"w":{"type":"number"}},"required":["w","h"],"type":"object"},"knockback":{"type":"number"},"reach":{"type":"number"},"recovery":{"type":"number"},"soundId":{"type":"string"}},"required":["animationKey","reach","recovery","attackSpeed","knockback","soundId"],"type":"object"},"category":{"const":"weapon"},"description":{"type":"string"},"family":{"description":"Weapon family — changes animation, reach, timing, feel.","enum":["sword","greatsword","dagger","axe","spear","chain","fist","magic","relic"]},"flavor":{"type":"string"},"icon":{"type":"string"},"id":{"pattern":"^[a-z0-9_]+$","type":"string"},"name":{"type":"string"},"rarity":{"enum":["common","uncommon","rare","epic","legendary"]},"specials":{"description":"Unique behaviors (spec §21).","items":{"additionalProperties":false,"properties":{"description":{"type":"string"},"effect":{"type":"string"},"trigger":{"enum":["hold_attack","down_attack","low_hp","accessory_combo","moonlit_room","full_hp","kill_streak"]}},"required":["trigger","effect"],"type":"object"},"type":"array"},"stats":{"additionalProperties":{"type":"number"},"description":"Flat stat bonuses, e.g. { atk: 12, str: 2, crit: 4 }.","type":"object"},"value":{"minimum":0,"type":"integer"}},"required":["id","name","category","family","description","rarity","value","icon","stats","attackProfile"],"title":"Weapon","type":"object"}