[{"attackProfile":{"animationKey":"lucien_attack_sword","attackSpeed":1,"hitbox":{"h":26,"w":36},"knockback":120,"reach":34,"recovery":0.32,"soundId":"swing_sword","anticipation":0.06,"activeFrames":2},"category":"weapon","description":"A plain arming sword issued to Vesper's gate watch. Balanced, unremarkable, reliable.","family":"sword","flavor":"Every legend starts with a borrowed edge.","icon":"recruit_blade","id":"recruit_blade","name":"Recruit's Blade","rarity":"common","stats":{"atk":8},"value":25},{"attackProfile":{"animationKey":"lucien_attack_sword","attackSpeed":1.25,"hitbox":{"h":26,"w":42},"knockback":140,"reach":40,"recovery":0.26,"soundId":"swing_sabre","anticipation":0.05,"activeFrames":2},"category":"weapon","description":"An old ceremonial blade whose edge glows beneath moonlight.","family":"sword","flavor":"Forged for an order that no longer answers its name.","icon":"moonsteel_sabre","id":"moonsteel_sabre","name":"Moonsteel Sabre","rarity":"rare","specials":[{"description":"Gains magic damage in moonlit rooms.","effect":"magic_damage","trigger":"moonlit_room"}],"stats":{"atk":34,"crit":4,"str":2},"value":850}]